{
  "$schema": "./erc8004.schema.json",
  "_comment": "ERC-8004 Agent Registration Configuration. Secrets should be in .env, not here.",
  
  "service": {
    "name": "Eliza Cloud",
    "description": "AI agent infrastructure: inference, agents, memory, billing. Supports REST, MCP, A2A protocols with x402 or API key authentication.",
    "image": "/logo.png",
    "version": "1.0.0",
    "category": "ai-infrastructure",
    "protocols": ["openai", "mcp", "a2a"],
    "supportedTrust": ["reputation", "crypto-economic"]
  },

  "networks": {
    "anvil": {
      "name": "Local Anvil",
      "chainId": 31337,
      "rpcUrl": "http://127.0.0.1:8545",
      "blockExplorer": "http://localhost:8545",
      "isTestnet": true,
      "contracts": {
        "identity": "0xcf7ed3acca5a467e9e704c703e8d87f634fb0fc9",
        "reputation": "0x5fc8d32690cc91d4c39d9d3abcbd16989f875707",
        "validation": "0xa513e6e4b8f2a923d98304ec87f64353c4d5c853"
      },
      "agentId": 0,
      "subgraphUrl": null
    },
    "base-sepolia": {
      "name": "Base Sepolia",
      "chainId": 84532,
      "rpcUrl": "https://sepolia.base.org",
      "blockExplorer": "https://sepolia.basescan.org",
      "isTestnet": true,
      "contracts": {
        "identity": "0x8004AA63c570c570eBF15376c0dB199918BFe9Fb",
        "reputation": "0x8004bd8daB57f14Ed299135749a5CB5c42d341BF",
        "validation": "0x8004C269D0A5647E51E121FeB226200ECE932d55"
      },
      "agentId": 1583,
      "subgraphUrl": "https://gateway.thegraph.com/api/00a452ad3cd1900273ea62c1bf283f93/subgraphs/id/GjQEDgEKqoh5Yc8MUgxoQoRATEJdEiH7HbocfR1aFiHa"
    },
    "base": {
      "name": "Base Mainnet",
      "chainId": 8453,
      "rpcUrl": "https://mainnet.base.org",
      "blockExplorer": "https://basescan.org",
      "isTestnet": false,
      "contracts": {
        "_comment": "Official agent0 contracts not yet deployed on mainnet. Deploy your own: cd docs/docs/erc-8004-contracts && npm run deploy:upgradeable:base",
        "_note": "After deployment, update these addresses and run: bun run onchain:register --network base",
        "identity": null,
        "reputation": null,
        "validation": null
      },
      "agentId": null,
      "subgraphUrl": null
    }
  },

  "endpoints": {
    "a2a": {
      "path": "/.well-known/agent-card.json",
      "version": "0.3.0"
    },
    "mcp": {
      "path": "/api/mcp",
      "version": "2025-06-18",
      "capabilities": {
        "tools": true,
        "resources": false,
        "prompts": false
      }
    },
    "openapi": {
      "path": "/api/openapi.json",
      "version": "3.1.0"
    }
  },

  "defaults": {
    "network": "base-sepolia",
    "productionNetwork": "base"
  }
}

